{
  "schema_version": "2.0.0",
  "strategy": "CurrentShortGrindRescueContract",
  "context": {
    "trading_mode": "futures",
    "margin_mode": "isolated",
    "timeframe": "5m",
    "timeframe_detail": "",
    "timerange": "20210204-20210209"
  },
  "summary": {
    "total_trades": 1,
    "starting_balance": "10000",
    "final_balance": "9915.83454658",
    "profit_total_abs": "-84.16545342",
    "total_volume": "2011.25766627",
    "rejected_signals": 0,
    "timedout_entry_orders": 0,
    "timedout_exit_orders": 0,
    "canceled_trade_entries": 0,
    "canceled_entry_orders": 0,
    "replaced_entry_orders": 0,
    "max_open_trades": 1
  },
  "locks": [],
  "trades": [
    {
      "sequence": 0,
      "pair": "BTC/USDT:USDT",
      "direction": "short",
      "open_timestamp_ms": 1612399500000,
      "close_timestamp_ms": 1612796700000,
      "open_rate": "40041.33",
      "close_rate": "43719.19",
      "amount": "0.024",
      "stake_amount": "192.198396",
      "max_stake_amount": "192.198396",
      "leverage": "5",
      "entry_tag": "620 ",
      "exit_reason": "exit_signal",
      "fees": {
        "open_rate": "0.0005",
        "open_cost": null,
        "open_currency": null,
        "close_rate": "0.0005",
        "close_cost": null,
        "close_currency": null,
        "funding": "5.108252852246366"
      },
      "profit": {
        "absolute": "-84.16545342",
        "ratio": "-0.4381283036233003"
      },
      "liquidation_price": null,
      "initial_stop_loss": "45410.11",
      "stop_loss": "45410.11",
      "orders": [
        {
          "sequence": 0,
          "side": "sell",
          "is_entry": true,
          "filled_timestamp_ms": 1612399500000,
          "amount": "0.013",
          "price": "37904.94",
          "cost": "493.01060211",
          "tag": "620 "
        },
        {
          "sequence": 1,
          "side": "sell",
          "is_entry": true,
          "filled_timestamp_ms": 1612788900000,
          "amount": "0.011",
          "price": "42566.16",
          "cost": "468.46187388",
          "tag": "gd5"
        },
        {
          "sequence": 2,
          "side": "buy",
          "is_entry": false,
          "filled_timestamp_ms": 1612796700000,
          "amount": "0.024",
          "price": "43719.19",
          "cost": "1049.78519028",
          "tag": "exit_signal"
        }
      ],
      "duration_minutes": 6620,
      "is_open": false,
      "minimum_rate": "36233",
      "maximum_rate": "45063.24",
      "initial_stop_loss_ratio": "-0.99",
      "stop_loss_ratio": "-0.99",
      "weekday": 0
    }
  ]
}
